{
  "view_id": "phase1-yolo-sample-yolo11-view",
  "manifest_id": "phase1-yolo-sample",
  "model_family": "yolo11",
  "model_variant": "yolo11s",
  "dataset_root": ".",
  "dataset_yaml_path": "sample_dataset.yaml",
  "annotation_format": "yolo_txt_normalized_xywh",
  "class_order": ["mug", "book"],
  "split_exports": {
    "train": {
      "images_dir": "generated/train/images",
      "labels_dir": "generated/train/labels",
      "asset_count": 1
    },
    "val": {
      "images_dir": "generated/val/images",
      "labels_dir": "generated/val/labels",
      "asset_count": 1
    },
    "test_real_heldout": {
      "images_dir": "generated/test_real_heldout/images",
      "labels_dir": "generated/test_real_heldout/labels",
      "asset_count": 1
    }
  },
  "created_at": "2026-04-15T00:00:00+00:00"
}
